{"$schema":"https://json-schema.org/draft/2020-12/schema","$id":"schema://frank.turn-receipt/v1","type":"object","additionalProperties":false,"required":["turn_id","state","completed_at","harness","usage","cost","request_ids","policy","fallback_chain","context_hash","attachment_hashes"],"properties":{"turn_id":{"type":"string","minLength":1},"state":{"enum":["completed","failed","cancelled"]},"completed_at":{"type":"string","format":"date-time"},"harness":{"type":"string","minLength":1},"upstream":{"type":"string","minLength":1},"usage":{"type":"object","additionalProperties":false,"required":["input_tokens","output_tokens"],"properties":{"input_tokens":{"type":"integer","minimum":0},"output_tokens":{"type":"integer","minimum":0}}},"cost":{"type":"object","additionalProperties":false,"required":["confidence","source"],"properties":{"amount":{"type":"string","minLength":1},"currency":{"type":"string","minLength":1},"confidence":{"enum":["reported","estimated","unavailable"]},"source":{"enum":["provider","catalogue","unavailable"]}}},"request_ids":{"type":"array","items":{"type":"string","minLength":1}},"policy":{"type":"object","additionalProperties":false,"required":["decision","result"],"properties":{"decision":{"type":"string","minLength":1},"result":{"type":"string","minLength":1}}},"fallback_chain":{"type":"array","items":{"type":"object"}},"context_hash":{"type":"string","pattern":"^[a-f0-9]{64}$"},"attachment_hashes":{"type":"array","items":{"type":"string","pattern":"^[a-f0-9]{64}$"}}}}
