{"turn_id":"turn_01","state":"completed","completed_at":"2026-08-11T00:00:00Z","harness":"hermes","usage":{"input_tokens":1,"output_tokens":2},"cost":{"confidence":"unavailable","source":"unavailable"},"request_ids":["req_01"],"policy":{"decision":"allow","result":"allow"},"fallback_chain":[],"context_hash":"aaaaaaaaaaaaaaaaaaaaaaaaaaaaaaaaaaaaaaaaaaaaaaaaaaaaaaaaaaaaaaaa","attachment_hashes":[]}
